GEOID_MSA,Name,Econ_Domain,Social_Domain,Env_Domain,Sustain_Index
310M300US21840,"Fairfield, IA Micro Area",0.434945595,0.636882004,0.460316156,1.532143755
310M300US21860,"Fairmont, MN Micro Area",0.542481599,0.60003632,0.387621482,1.530139401
310M300US21900,"Fairmont, WV Micro Area",0.500708567,0.586278746,0.354076017,1.44106333
310M300US21980,"Fallon, NV Micro Area",0.483026079,0.58857677,0.43121172,1.502814569
310M300US22020,"Fargo, ND-MN Metro Area",0.576108145,0.564163293,0.413711468,1.553982906
310M300US22060,"Faribault-Northfield, MN Micro Area",0.55104773,0.631334412,0.418850178,1.601232319
310M300US22100,"Farmington, MO Micro Area",0.457142157,0.525780984,0.435863213,1.418786354
310M300US22140,"Farmington, NM Metro Area",0.412241611,0.563373531,0.4168476,1.392462742
310M300US22180,"Fayetteville, NC Metro Area",0.414549915,0.474927713,0.423342942,1.31282057
310M300US22220,"Fayetteville-Springdale-Rogers, AR-MO Metro Area",0.511200568,0.593737043,0.444157705,1.549095316
310M300US22260,"Fergus Falls, MN Micro Area",0.544534248,0.624138987,0.440194511,1.608867746
310M300US22280,"Fernley, NV Micro Area",0.482519502,0.579970035,0.376341092,1.438830629
310M300US22300,"Findlay, OH Micro Area",0.540611861,0.607366093,0.257593418,1.405571372
310M300US22340,"Fitzgerald, GA Micro Area",0.316437701,0.465044885,0.439128594,1.22061118
310M300US22380,"Flagstaff, AZ Metro Area",0.444570187,0.491918477,0.447443553,1.383932217
310M300US22420,"Flint, MI Metro Area",0.383694937,0.571834997,0.289860408,1.245390342
310M300US22500,"Florence, SC Metro Area",0.369930786,0.588900058,0.441338325,1.40016917
310M300US22520,"Florence-Muscle Shoals, AL Metro Area",0.44877368,0.603856089,0.43545937,1.488089139
310M300US22540,"Fond du Lac, WI Metro Area",0.567164357,0.625672448,0.426129091,1.618965896
310M300US22580,"Forest City, NC Micro Area",0.385179576,0.555627261,0.435503126,1.376309963
310M300US22620,"Forrest City, AR Micro Area",0.30194984,0.518962569,0.439046107,1.259958516
310M300US22660,"Fort Collins, CO Metro Area",0.587950409,0.629205664,0.415040184,1.632196257
310M300US22700,"Fort Dodge, IA Micro Area",0.444159599,0.576815923,0.346864351,1.367839873
310M300US22780,"Fort Leonard Wood, MO Micro Area",0.507265525,0.432243674,0.441860387,1.381369586
310M300US22800,"Fort Madison-Keokuk, IA-IL-MO Micro Area",0.49060401,0.608631744,0.430986783,1.530222538
310M300US22820,"Fort Morgan, CO Micro Area",0.535658482,0.592280019,0.435619627,1.563558127
310M300US22840,"Fort Payne, AL Micro Area",0.405477339,0.603544082,0.453681613,1.462703033
310M300US22860,"Fort Polk South, LA Micro Area",0.47308857,0.491626639,0.453481798,1.418197007
310M300US22900,"Fort Smith, AR-OK Metro Area",0.404507257,0.535665448,0.426603384,1.366776089
310M300US23060,"Fort Wayne, IN Metro Area",0.504975509,0.597302117,0.39461864,1.496896266
310M300US23140,"Frankfort, IN Micro Area",0.527968232,0.576858734,0.292887609,1.397714575
310M300US23180,"Frankfort, KY Micro Area",0.530616605,0.5750816,0.382055081,1.487753286
310M300US23240,"Fredericksburg, TX Micro Area",0.506314808,0.637230783,0.469344383,1.612889974
310M300US23300,"Freeport, IL Micro Area",0.449778573,0.563913408,0.264275313,1.277967293
310M300US23340,"Fremont, NE Micro Area",0.526389179,0.557942991,0.406456308,1.490788478
310M300US23380,"Fremont, OH Micro Area",0.514969534,0.566042849,0.352942235,1.433954617
310M300US23420,"Fresno, CA Metro Area",0.364158566,0.52711757,0.498515121,1.389791257
310M300US23460,"Gadsden, AL Metro Area",0.418703261,0.593026999,0.460379875,1.472110135
310M300US23500,"Gaffney, SC Micro Area",0.356840161,0.591469141,0.448080044,1.396389346
310M300US23540,"Gainesville, FL Metro Area",0.402815777,0.526546197,0.381108746,1.310470721
310M300US23580,"Gainesville, GA Metro Area",0.492345817,0.572091779,0.471254111,1.535691707
310M300US23620,"Gainesville, TX Micro Area",0.52713665,0.561105733,0.438073286,1.526315669
310M300US23660,"Galesburg, IL Micro Area",0.449290512,0.559467753,0.43355418,1.442312446
310M300US23700,"Gallup, NM Micro Area",0.170161367,0.533142113,0.397387165,1.100690645
310M300US23780,"Garden City, KS Micro Area",0.485534983,0.531386566,0.442469229,1.459390778
310M300US23820,"Gardnerville Ranchos, NV Micro Area",0.562291154,0.602979059,0.396755674,1.562025888
310M300US23860,"Georgetown, SC Micro Area",0.390498346,0.626957928,0.400569756,1.41802603
310M300US23900,"Gettysburg, PA Metro Area",0.584412832,0.636001772,0.478844518,1.699259122
310M300US23940,"Gillette, WY Micro Area",0.633794721,0.568658125,0.463849494,1.66630234
310M300US23980,"Glasgow, KY Micro Area",0.393646389,0.563262242,0.421271327,1.378179959
310M300US24020,"Glens Falls, NY Metro Area",0.524539246,0.554562571,0.374627657,1.453729474
310M300US24060,"Glenwood Springs, CO Micro Area",0.586953529,0.591914318,0.488461739,1.667329586
310M300US24100,"Gloversville, NY Micro Area",0.461736192,0.536065564,0.372646498,1.370448253
310M300US24140,"Goldsboro, NC Metro Area",0.396154781,0.524202088,0.454781305,1.375138174
310M300US24220,"Grand Forks, ND-MN Metro Area",0.521656848,0.541371227,0.410131802,1.473159877
310M300US24260,"Grand Island, NE Metro Area",0.529962351,0.571731454,0.445264363,1.546958168
310M300US24300,"Grand Junction, CO Metro Area",0.472119273,0.610797802,0.419635568,1.502552643
310M300US24330,"Grand Rapids, MN Micro Area",0.499955024,0.619343921,0.43997518,1.559274124
310M300US24340,"Grand Rapids-Wyoming, MI Metro Area",0.53197186,0.622111678,0.274739724,1.428823263
310M300US24380,"Grants, NM Micro Area",0.283351039,0.47797196,0.444691934,1.206014933
310M300US24420,"Grants Pass, OR Metro Area",0.384574464,0.622598663,0.388031558,1.395204685
310M300US24460,"Great Bend, KS Micro Area",0.480957009,0.550371326,0.397082544,1.42841088
310M300US24500,"Great Falls, MT Metro Area",0.4910806,0.574455462,0.394522556,1.460058618
310M300US24540,"Greeley, CO Metro Area",0.56493976,0.649816402,0.450479573,1.665235734
310M300US24580,"Green Bay, WI Metro Area",0.547172011,0.602424122,0.433260645,1.582856777
310M300US24620,"Greeneville, TN Micro Area",0.409968449,0.543312748,0.410090074,1.363371271
310M300US24640,"Greenfield Town, MA Micro Area",0.524850653,0.626184437,0.39569282,1.546727911
310M300US24660,"Greensboro-High Point, NC Metro Area",0.449767732,0.554328634,0.460834289,1.464930654
310M300US24700,"Greensburg, IN Micro Area",0.552774609,0.56010467,0.412049569,1.524928847
310M300US24740,"Greenville, MS Micro Area",0.178210516,0.419667766,0.449998942,1.047877225
310M300US24780,"Greenville, NC Metro Area",0.36792702,0.501663644,0.460211478,1.329802143
310M300US24820,"Greenville, OH Micro Area",0.523743819,0.623714883,0.30901029,1.456468993
310M300US24860,"Greenville-Anderson-Mauldin, SC Metro Area",0.479259169,0.605634284,0.454931284,1.539824737
310M300US24900,"Greenwood, MS Micro Area",0.219845125,0.505878489,0.455911602,1.181635215
310M300US24940,"Greenwood, SC Micro Area",0.349693374,0.559292814,0.42130412,1.330290309
310M300US24980,"Grenada, MS Micro Area",0.313201576,0.482069291,0.437871742,1.233142608
310M300US25060,"Gulfport-Biloxi-Pascagoula, MS Metro Area",0.435868856,0.484787154,0.432116932,1.352772941
310M300US25100,"Guymon, OK Micro Area",0.498116391,0.537271303,0.416450232,1.451837925
310M300US25180,"Hagerstown-Martinsburg, MD-WV Metro Area",0.522448533,0.575309659,0.444307822,1.542066014
310M300US25200,"Hailey, ID Micro Area",0.520177576,0.520208374,0.499159219,1.53954517
310M300US25220,"Hammond, LA Metro Area",0.407131701,0.527706537,0.429289491,1.364127729
310M300US25260,"Hanford-Corcoran, CA Metro Area",0.416009904,0.518059405,0.494403055,1.428472364
310M300US25300,"Hannibal, MO Micro Area",0.466062711,0.56486638,0.44478277,1.475711861
310M300US25420,"Harrisburg-Carlisle, PA Metro Area",0.568247499,0.591558762,0.467126598,1.626932859
310M300US25460,"Harrison, AR Micro Area",0.451503807,0.634016027,0.452112937,1.537632772
310M300US25500,"Harrisonburg, VA Metro Area",0.501331817,0.545883751,0.476806156,1.524021723
310M300US25540,"Hartford-West Hartford-East Hartford, CT Metro Area",0.564511509,0.605043086,0.441237343,1.610791938
310M300US25580,"Hastings, NE Micro Area",0.511438244,0.595506498,0.454222005,1.561166747
310M300US25620,"Hattiesburg, MS Metro Area",0.382387845,0.494504743,0.426061066,1.302953654
310M300US25700,"Hays, KS Micro Area",0.492955959,0.53867105,0.413610532,1.445237541
310M300US25720,"Heber, UT Micro Area",0.666083547,0.572114441,0.4879027,1.726100689
310M300US25740,"Helena, MT Micro Area",0.590742315,0.610271343,0.459447377,1.660461036
310M300US25760,"Helena-West Helena, AR Micro Area",0.181180434,0.463225345,0.431547528,1.075953307
310M300US25780,"Henderson, NC Micro Area",0.299178116,0.488505077,0.457972112,1.245655305
310M300US25820,"Hereford, TX Micro Area",0.509278405,0.529561649,0.459329607,1.498169662
310M300US25840,"Hermiston-Pendleton, OR Micro Area",0.44919136,0.555569392,0.46889846,1.473659212
310M300US25860,"Hickory-Lenoir-Morganton, NC Metro Area",0.436283099,0.580648974,0.450949847,1.46788192
310M300US25880,"Hillsdale, MI Micro Area",0.453630628,0.599258124,0.366337417,1.419226169
310M300US25900,"Hilo, HI Micro Area",0.475065129,0.545169253,0.532467844,1.552702226
310M300US25940,"Hilton Head Island-Bluffton-Beaufort, SC Metro Area",0.487473225,0.592632574,0.449930101,1.5300359
310M300US25980,"Hinesville, GA Metro Area",0.423261153,0.429818945,0.427900151,1.280980249
310M300US26020,"Hobbs, NM Micro Area",0.495718601,0.54632794,0.483070395,1.525116936
310M300US26090,"Holland, MI Micro Area",0.563661443,0.661057937,0.277394602,1.502113982
310M300US26140,"Homosassa Springs, FL Metro Area",0.40348859,0.626614718,0.458037162,1.48814047
310M300US26220,"Hood River, OR Micro Area",0.549454036,0.632029002,0.438429661,1.619912698
310M300US26260,"Hope, AR Micro Area",0.40349939,0.544923597,0.464243075,1.412666062
310M300US26300,"Hot Springs, AR Metro Area",0.400562007,0.58030244,0.462581174,1.443445621
310M300US26340,"Houghton, MI Micro Area",0.412818601,0.587545325,0.29688726,1.297251187
310M300US26380,"Houma-Thibodaux, LA Metro Area",0.463154812,0.563245174,0.421050445,1.447450431
310M300US26420,"Houston-The Woodlands-Sugar Land, TX Metro Area",0.497827336,0.548996915,0.462917326,1.509741577
310M300US26460,"Hudson, NY Micro Area",0.531831427,0.563800488,0.426751854,1.522383769
310M300US26500,"Huntingdon, PA Micro Area",0.477530289,0.570527402,0.447060515,1.495118206
310M300US26540,"Huntington, IN Micro Area",0.551130374,0.623405122,0.394662322,1.569197818
310M300US26580,"Huntington-Ashland, WV-KY-OH Metro Area",0.429888883,0.564174119,0.401475876,1.395538877
310M300US26620,"Huntsville, AL Metro Area",0.515238974,0.622964556,0.455631583,1.593835113
310M300US26660,"Huntsville, TX Micro Area",0.410251734,0.488526697,0.440943386,1.339721817
310M300US26700,"Huron, SD Micro Area",0.480828394,0.602968573,0.441969853,1.52576682
310M300US26740,"Hutchinson, KS Micro Area",0.497534513,0.564968489,0.43756815,1.500071151
310M300US26780,"Hutchinson, MN Micro Area",0.579153946,0.661369449,0.399457199,1.639980594
310M300US26820,"Idaho Falls, ID Metro Area",0.519279434,0.624387176,0.486074915,1.629741526
310M300US26860,"Indiana, PA Micro Area",0.434451245,0.597640151,0.449076191,1.481167586
310M300US26900,"Indianapolis-Carmel-Anderson, IN Metro Area",0.510596659,0.569882204,0.423374001,1.503852865
310M300US26940,"Indianola, MS Micro Area",0.165599338,0.460301701,0.459685672,1.085586711
310M300US26960,"Ionia, MI Micro Area",0.509195383,0.630164423,0.256440147,1.395799953
310M300US26980,"Iowa City, IA Metro Area",0.541828311,0.60743685,0.425424386,1.574689547
310M300US27020,"Iron Mountain, MI-WI Micro Area",0.477916666,0.574625099,0.357417222,1.409958987
310M300US27060,"Ithaca, NY Metro Area",0.478672921,0.5337607,0.377590418,1.39002404
310M300US27100,"Jackson, MI Metro Area",0.46205948,0.580151069,0.241065551,1.2832761
310M300US27140,"Jackson, MS Metro Area",0.431058336,0.550776701,0.45416444,1.435999477
310M300US27160,"Jackson, OH Micro Area",0.393152298,0.550480923,0.322375753,1.266008973
310M300US27180,"Jackson, TN Metro Area",0.421106147,0.528918993,0.376022105,1.326047245
310M300US27220,"Jackson, WY-ID Micro Area",0.674288786,0.531413936,0.510255131,1.715957853
310M300US27260,"Jacksonville, FL Metro Area",0.495510646,0.568466992,0.444722166,1.508699804
310M300US27300,"Jacksonville, IL Micro Area",0.468436803,0.584173777,0.451498349,1.50410893
310M300US27340,"Jacksonville, NC Metro Area",0.46465686,0.464074501,0.440745976,1.369477338
310M300US27380,"Jacksonville, TX Micro Area",0.411961553,0.571382693,0.422788379,1.406132626
310M300US27420,"Jamestown, ND Micro Area",0.59097021,0.551629884,0.405369699,1.547969794
310M300US27460,"Jamestown-Dunkirk-Fredonia, NY Micro Area",0.427911595,0.547170691,0.379510067,1.354592352
310M300US27500,"Janesville-Beloit, WI Metro Area",0.503479674,0.579089698,0.43247561,1.515044982
310M300US27540,"Jasper, IN Micro Area",0.569534114,0.646626011,0.308815591,1.524975716
310M300US27600,"Jefferson, GA Micro Area",0.503658143,0.62330898,0.483312576,1.610279699
310M300US27620,"Jefferson City, MO Metro Area",0.529470388,0.571287572,0.465367889,1.566125849
310M300US27660,"Jennings, LA Micro Area",0.372882272,0.560604764,0.431932587,1.365419624
310M300US27700,"Jesup, GA Micro Area",0.380876761,0.538348041,0.461125023,1.380349826
310M300US27740,"Johnson City, TN Metro Area",0.413879901,0.530597482,0.409425467,1.353902851
310M300US27780,"Johnstown, PA Metro Area",0.451738367,0.590812533,0.430869584,1.473420484
310M300US27860,"Jonesboro, AR Metro Area",0.449742375,0.506785115,0.44760921,1.4041367
310M300US27900,"Joplin, MO Metro Area",0.477438478,0.57542273,0.390100514,1.442961722
310M300US27920,"Junction City, KS Micro Area",0.504310817,0.435168087,0.417513006,1.35699191
310M300US27940,"Juneau, AK Micro Area",0.698329272,0.531961657,0.435371656,1.665662585
310M300US27980,"Kahului-Wailuku-Lahaina, HI Metro Area",0.613557456,0.507235525,0.403381663,1.524174645
310M300US28020,"Kalamazoo-Portage, MI Metro Area",0.47468882,0.573324432,0.290795381,1.338808632
310M300US28060,"Kalispell, MT Micro Area",0.503540945,0.617259797,0.45878337,1.579584112
310M300US28100,"Kankakee, IL Metro Area",0.483478636,0.555096368,0.445278174,1.483853178
310M300US28140,"Kansas City, MO-KS Metro Area",0.54839533,0.562010825,0.454400783,1.564806939
310M300US28180,"Kapaa, HI Micro Area",0.605892692,0.542042236,0.375339107,1.523274034
310M300US28260,"Kearney, NE Micro Area",0.531448864,0.591908394,0.425817753,1.549175011
310M300US28300,"Keene, NH Micro Area",0.544135732,0.548313677,0.399547702,1.491997111
310M300US28340,"Kendallville, IN Micro Area",0.531984663,0.568474425,0.413213794,1.513672882
310M300US28380,"Kennett, MO Micro Area",0.333066283,0.490871402,0.447203673,1.271141358
310M300US28420,"Kennewick-Richland, WA Metro Area",0.535318277,0.59759327,0.422707634,1.555619181
310M300US28500,"Kerrville, TX Micro Area",0.485016553,0.54725279,0.459274995,1.491544338
310M300US28540,"Ketchikan, AK Micro Area",0.594152356,0.470100147,0.475155227,1.53940773
310M300US28580,"Key West, FL Micro Area",0.570237575,0.495761953,0.391851498,1.457851027
310M300US28620,"Kill Devil Hills, NC Micro Area",0.531043893,0.491031692,0.487787075,1.50986266
310M300US28660,"Killeen-Temple, TX Metro Area",0.48475064,0.48528378,0.425519947,1.395554366
310M300US28700,"Kingsport-Bristol-Bristol, TN-VA Metro Area",0.430646769,0.562084432,0.426951792,1.419682994
310M300US28740,"Kingston, NY Metro Area",0.500640925,0.577926983,0.404489182,1.483057089
310M300US28780,"Kingsville, TX Micro Area",0.383652824,0.469007775,0.781308131,1.633968729
310M300US28820,"Kinston, NC Micro Area",0.336473948,0.490423599,0.462974846,1.289872393
310M300US28860,"Kirksville, MO Micro Area",0.384772144,0.534674197,0.436030515,1.355476856
310M300US28900,"Klamath Falls, OR Micro Area",0.421324287,0.564634877,0.434961481,1.420920646
310M300US28940,"Knoxville, TN Metro Area",0.46997729,0.566207511,0.427237363,1.463422164
310M300US29020,"Kokomo, IN Metro Area",0.478477625,0.547082778,0.297062814,1.322623216
310M300US29060,"Laconia, NH Micro Area",0.566824002,0.551651229,0.431155662,1.549630892
310M300US29100,"La Crosse-Onalaska, WI-MN Metro Area",0.5285507,0.62178725,0.465439845,1.615777795
310M300US29180,"Lafayette, LA Metro Area",0.450714065,0.558259709,0.450132024,1.459105798
310M300US29200,"Lafayette-West Lafayette, IN Metro Area",0.485011367,0.554322302,0.384221998,1.423555667
310M300US29260,"La Grande, OR Micro Area",0.444762322,0.574592195,0.418102494,1.437457011
310M300US29300,"LaGrange, GA Micro Area",0.382950163,0.476032512,0.4651799,1.324162574
310M300US29340,"Lake Charles, LA Metro Area",0.476281498,0.559128599,0.447977481,1.483387578
310M300US29380,"Lake City, FL Micro Area",0.39856408,0.566616787,0.40348875,1.368669618
310M300US29420,"Lake Havasu City-Kingman, AZ Metro Area",0.394999054,0.518080858,0.42362217,1.336702083
310M300US29460,"Lakeland-Winter Haven, FL Metro Area",0.443306667,0.546169834,0.444878146,1.434354646
310M300US29500,"Lamesa, TX Micro Area",0.378675021,0.519145581,0.451914238,1.34973484
310M300US29540,"Lancaster, PA Metro Area",0.565152361,0.620536268,0.462705085,1.648393714
310M300US29620,"Lansing-East Lansing, MI Metro Area",0.48680766,0.578177555,0.257828713,1.322813928
310M300US29660,"Laramie, WY Micro Area",0.450083127,0.534671417,0.517644043,1.502398588
310M300US29700,"Laredo, TX Metro Area",0.307519782,0.528409433,0.454235324,1.290164538
310M300US29740,"Las Cruces, NM Metro Area",0.32482296,0.578201903,0.487937511,1.390962374
310M300US29780,"Las Vegas, NM Micro Area",0.280783069,0.400901619,0.413518978,1.095203665
310M300US29820,"Las Vegas-Henderson-Paradise, NV Metro Area",0.484175019,0.484976239,0.491180358,1.460331617
310M300US29860,"Laurel, MS Micro Area",0.35890874,0.573446285,0.436775461,1.369130486
310M300US29900,"Laurinburg, NC Micro Area",0.271053919,0.474056647,0.474605882,1.219716448
310M300US29940,"Lawrence, KS Metro Area",0.502799415,0.519402995,0.440779861,1.462982271
310M300US29980,"Lawrenceburg, TN Micro Area",0.420268216,0.572408844,0.397441509,1.390118569
310M300US30020,"Lawton, OK Metro Area",0.454225954,0.449177298,0.398808103,1.302211355
310M300US30060,"Lebanon, MO Micro Area",0.439589085,0.566046463,0.428606294,1.434241842
310M300US30140,"Lebanon, PA Metro Area",0.551931736,0.602365425,0.482186529,1.63648369
310M300US30220,"Levelland, TX Micro Area",0.459037722,0.548518282,0.440252265,1.447808269
310M300US30260,"Lewisburg, PA Micro Area",0.529760365,0.570180947,0.453844018,1.55378533
310M300US30280,"Lewisburg, TN Micro Area",0.473231017,0.544294813,0.417018359,1.434544188
310M300US30300,"Lewiston, ID-WA Metro Area",0.525346421,0.568961859,0.430148098,1.524456378
310M300US30340,"Lewiston-Auburn, ME Metro Area",0.497524143,0.559786255,0.435016023,1.492326421
310M300US30380,"Lewistown, PA Micro Area",0.505109596,0.570485668,0.431401283,1.506996547
310M300US30420,"Lexington, NE Micro Area",0.519380191,0.541214233,0.462107775,1.5227022
310M300US30460,"Lexington-Fayette, KY Metro Area",0.486333261,0.549818451,0.402306381,1.438458094
310M300US30580,"Liberal, KS Micro Area",0.42124592,0.517846316,0.388681764,1.327774001
310M300US30620,"Lima, OH Metro Area",0.463950727,0.553943056,0.297562211,1.315455995
310M300US30660,"Lincoln, IL Micro Area",0.561606159,0.612612359,0.439847587,1.614066106
310M300US30700,"Lincoln, NE Metro Area",0.543398939,0.568829812,0.435792448,1.548021198
310M300US30780,"Little Rock-North Little Rock-Conway, AR Metro Area",0.490420325,0.58418852,0.460744824,1.535353669
310M300US30820,"Lock Haven, PA Micro Area",0.474037515,0.555793054,0.465519178,1.495349747
310M300US30860,"Logan, UT-ID Metro Area",0.505764028,0.604894632,0.427101089,1.53775975
310M300US30880,"Logan, WV Micro Area",0.328540159,0.533532889,0.410816996,1.272890043
310M300US30900,"Logansport, IN Micro Area",0.476956413,0.571605006,0.389673635,1.438235054
310M300US30940,"London, KY Micro Area",0.302792099,0.582464885,0.426805474,1.312062458
310M300US30980,"Longview, TX Metro Area",0.470249354,0.527108036,0.444362334,1.441719724
310M300US31020,"Longview, WA Metro Area",0.457382655,0.570724751,0.411916459,1.440023864
310M300US31060,"Los Alamos, NM Micro Area",0.774798033,0.650411184,0.318067241,1.743276458
310M300US31080,"Los Angeles-Long Beach-Anaheim, CA Metro Area",0.532257733,0.543857528,0.584845204,1.660960464
310M300US31140,"Louisville/Jefferson County, KY-IN Metro Area",0.50522141,0.574780429,0.429541889,1.509543729
310M300US31180,"Lubbock, TX Metro Area",0.457791988,0.479575175,0.434936767,1.372303929
310M300US31220,"Ludington, MI Micro Area",0.423878004,0.570069059,0.270687328,1.264634391
310M300US31260,"Lufkin, TX Micro Area",0.433214225,0.503733537,0.414867462,1.351815224
310M300US31300,"Lumberton, NC Micro Area",0.285711831,0.505785002,0.430644546,1.222141379
310M300US31340,"Lynchburg, VA Metro Area",0.503269044,0.58039186,0.415655157,1.499316061
310M300US31380,"Macomb, IL Micro Area",0.406088619,0.549070146,0.416377658,1.371536423
310M300US31420,"Macon-Bibb County, GA Metro Area",0.338590789,0.50309887,0.465129828,1.306819488
310M300US31460,"Madera, CA Metro Area",0.407552001,0.587780316,0.482373067,1.477705384
310M300US31500,"Madison, IN Micro Area",0.508638202,0.552641357,0.414563077,1.475842636
310M300US31540,"Madison, WI Metro Area",0.59219068,0.600444491,0.447970573,1.640605744
310M300US31580,"Madisonville, KY Micro Area",0.46034567,0.558718775,0.419429258,1.438493703
310M300US31620,"Magnolia, AR Micro Area",0.330588644,0.629031085,0.469703509,1.429323238
310M300US31660,"Malone, NY Micro Area",0.424859919,0.517082452,0.411383851,1.353326222
310M300US31680,"Malvern, AR Micro Area",0.435894126,0.542532577,0.455291231,1.433717933
310M300US31700,"Manchester-Nashua, NH Metro Area",0.621983504,0.552827359,0.410864877,1.58567574
310M300US31740,"Manhattan, KS Metro Area",0.500844722,0.515713017,0.420597057,1.437154795
310M300US31820,"Manitowoc, WI Micro Area",0.552685783,0.638722982,0.366176007,1.557584771
310M300US31860,"Mankato-North Mankato, MN Metro Area",0.5268528,0.608022329,0.397343848,1.532218977
310M300US31900,"Mansfield, OH Metro Area",0.450369199,0.572453725,0.333818812,1.356641736
310M300US31930,"Marietta, OH Micro Area",0.47719886,0.586922893,0.348610613,1.412732366
310M300US31940,"Marinette, WI-MI Micro Area",0.487142889,0.531308168,0.387785636,1.406236694
310M300US31980,"Marion, IN Micro Area",0.456228344,0.513691273,0.397292251,1.367211868
310M300US32000,"Marion, NC Micro Area",0.41744928,0.539434239,0.450002055,1.406885574
310M300US32020,"Marion, OH Micro Area",0.446398086,0.563406148,0.318830507,1.32863474
310M300US32100,"Marquette, MI Micro Area",0.474606415,0.566919686,0.328549246,1.370075347
310M300US32140,"Marshall, MN Micro Area",0.5100397,0.615845983,0.404030655,1.529916338
310M300US32180,"Marshall, MO Micro Area",0.460335885,0.524790481,0.428158568,1.413284934
310M300US32220,"Marshall, TX Micro Area",0.437904686,0.589744608,0.415278806,1.442928099
310M300US32260,"Marshalltown, IA Micro Area",0.54544056,0.610502017,0.343656962,1.499599539
310M300US32280,"Martin, TN Micro Area",0.405551611,0.53467865,0.411760415,1.351990676
310M300US32300,"Martinsville, VA Micro Area",0.374008932,0.531797467,0.446035698,1.351842098
310M300US32340,"Maryville, MO Micro Area",0.434148259,0.526456241,0.4555543,1.416158801
310M300US32380,"Mason City, IA Micro Area",0.525478524,0.606030277,0.399656769,1.53116557
310M300US32460,"Mayfield, KY Micro Area",0.409850731,0.596982813,0.423056946,1.42989049
310M300US32500,"Maysville, KY Micro Area",0.405504896,0.550688977,0.405992535,1.362186408
310M300US32540,"McAlester, OK Micro Area",0.447815948,0.510587258,0.411411684,1.36981489
310M300US32580,"McAllen-Edinburg-Mission, TX Metro Area",0.273728727,0.530004719,0.404487694,1.20822114
310M300US32620,"McComb, MS Micro Area",0.266790317,0.53503794,0.460975367,1.262803625
310M300US32660,"McMinnville, TN Micro Area",0.389356823,0.535559567,0.43072139,1.355637781
310M300US32700,"McPherson, KS Micro Area",0.59743955,0.606715303,0.432366539,1.636521392
310M300US32740,"Meadville, PA Micro Area",0.477546321,0.556422499,0.458442499,1.492411319
310M300US32780,"Medford, OR Metro Area",0.449619275,0.590421107,0.423177051,1.463217432
310M300US32820,"Memphis, TN-MS-AR Metro Area",0.421129958,0.516479648,0.433719939,1.371329544
310M300US32860,"Menomonie, WI Micro Area",0.52518909,0.621647973,0.441195571,1.588032634
310M300US32900,"Merced, CA Metro Area",0.33800213,0.529442335,0.467317255,1.33476172
310M300US32940,"Meridian, MS Micro Area",0.365919434,0.50453831,0.436985872,1.307443616
310M300US32980,"Merrill, WI Micro Area",0.568722042,0.593873,0.398215355,1.560810397
310M300US33020,"Mexico, MO Micro Area",0.436806637,0.564768554,0.429640069,1.43121526
310M300US33060,"Miami, OK Micro Area",0.395651791,0.523072195,0.386592277,1.305316264
310M300US33100,"Miami-Fort Lauderdale-West Palm Beach, FL Metro Area",0.438067509,0.530653087,0.454023234,1.42274383
310M300US33140,"Michigan City-La Porte, IN Metro Area",0.460762271,0.570640598,0.422686619,1.454089489
310M300US33180,"Middlesborough, KY Micro Area",0.209131504,0.49931229,0.395227814,1.103671609
310M300US33220,"Midland, MI Metro Area",0.509698152,0.646490777,0.268833435,1.425022363
310M300US33260,"Midland, TX Metro Area",0.609022809,0.546032084,0.446195838,1.601250731
310M300US33300,"Milledgeville, GA Micro Area",0.305941688,0.454203547,0.45668672,1.216831955
310M300US33340,"Milwaukee-Waukesha-West Allis, WI Metro Area",0.50334319,0.585175295,0.405125036,1.493643522
310M300US33420,"Mineral Wells, TX Micro Area",0.421691659,0.488606577,0.492664812,1.402963048
