GEOID_MSA,Name,Econ_Domain,Social_Domain,Env_Domain,Sustain_Index
310M300US45380,"Taylorville, IL Micro Area",0.517674005,0.608172944,0.40280732,1.52865427
310M300US45460,"Terre Haute, IN Metro Area",0.455380031,0.53475935,0.401094856,1.391234237
310M300US45500,"Texarkana, TX-AR Metro Area",0.409043514,0.55450444,0.405431383,1.368979336
310M300US45520,"The Dalles, OR Micro Area",0.477735817,0.567406626,0.438293304,1.483435747
310M300US45540,"The Villages, FL Metro Area",0.527312918,0.715112841,0.455906033,1.698331792
310M300US45580,"Thomaston, GA Micro Area",0.329508515,0.558694283,0.425602582,1.31380538
310M300US45620,"Thomasville, GA Micro Area",0.377572658,0.499950786,0.459418918,1.336942362
310M300US45660,"Tiffin, OH Micro Area",0.491595406,0.573728108,0.353513907,1.418837421
310M300US45700,"Tifton, GA Micro Area",0.346362255,0.48537718,0.457540334,1.289279769
310M300US45740,"Toccoa, GA Micro Area",0.353991142,0.551890106,0.485637015,1.391518263
310M300US45780,"Toledo, OH Metro Area",0.436348538,0.54555262,0.30522015,1.287121308
310M300US45820,"Topeka, KS Metro Area",0.534033024,0.576517117,0.426895067,1.537445209
310M300US45860,"Torrington, CT Micro Area",0.593683112,0.6610079,0.452036818,1.706727831
310M300US45900,"Traverse City, MI Micro Area",0.519043447,0.620370008,0.321672031,1.461085486
310M300US45940,"Trenton, NJ Metro Area",0.539964001,0.580130899,0.466540287,1.586635187
310M300US45980,"Troy, AL Micro Area",0.314271073,0.482493553,0.434845786,1.231610413
310M300US46020,"Truckee-Grass Valley, CA Micro Area",0.528782323,0.615901147,0.496231126,1.640914596
310M300US46060,"Tucson, AZ Metro Area",0.432504125,0.541923503,0.428405475,1.402833104
310M300US46100,"Tullahoma-Manchester, TN Micro Area",0.453355241,0.576711805,0.41477335,1.444840395
310M300US46140,"Tulsa, OK Metro Area",0.486723558,0.53997597,0.433450945,1.460150473
310M300US46180,"Tupelo, MS Micro Area",0.431736221,0.539756476,0.454951063,1.426443761
310M300US46220,"Tuscaloosa, AL Metro Area",0.433109322,0.584232574,0.488763363,1.506105259
310M300US46300,"Twin Falls, ID Micro Area",0.491259811,0.573317787,0.428762776,1.493340374
310M300US46340,"Tyler, TX Metro Area",0.467770887,0.556325696,0.456827043,1.480923627
310M300US46380,"Ukiah, CA Micro Area",0.390485032,0.553704717,0.360124533,1.304314282
310M300US46460,"Union City, TN-KY Micro Area",0.372021217,0.518363782,0.429977797,1.320362796
310M300US46500,"Urbana, OH Micro Area",0.527466728,0.591717428,0.268593846,1.387778002
310M300US46520,"Urban Honolulu, HI Metro Area",0.693333669,0.545476225,0.418898253,1.657708147
310M300US46540,"Utica-Rome, NY Metro Area",0.468156644,0.554813484,0.364816231,1.387786358
310M300US46620,"Uvalde, TX Micro Area",0.418198779,0.535163656,0.459937969,1.413300404
310M300US46660,"Valdosta, GA Metro Area",0.329978869,0.489639719,0.480172391,1.29979098
310M300US46700,"Vallejo-Fairfield, CA Metro Area",0.583327934,0.558611172,0.454670828,1.596609935
310M300US46740,"Valley, AL Micro Area",0.40129871,0.550689266,0.449945129,1.401933105
310M300US46780,"Van Wert, OH Micro Area",0.516302095,0.609352378,0.394817511,1.520471983
310M300US46820,"Vermillion, SD Micro Area",0.386380386,0.504210003,0.442284096,1.332874485
310M300US46860,"Vernal, UT Micro Area",0.528645983,0.580981935,0.478929839,1.588557758
310M300US46900,"Vernon, TX Micro Area",0.460119058,0.443769223,0.435608992,1.339497273
310M300US46980,"Vicksburg, MS Micro Area",0.332544858,0.523446504,0.451717159,1.307708521
310M300US47020,"Victoria, TX Metro Area",0.496639494,0.542910394,0.460785437,1.500335325
310M300US47080,"Vidalia, GA Micro Area",0.309513762,0.529664589,0.480194144,1.319372495
310M300US47180,"Vincennes, IN Micro Area",0.483964073,0.524731577,0.389825798,1.398521448
310M300US47220,"Vineland-Bridgeton, NJ Metro Area",0.41784714,0.524616703,0.393459283,1.335923127
310M300US47240,"Vineyard Haven, MA Micro Area",0.612591962,0.555482758,0.418903235,1.586977955
310M300US47260,"Virginia Beach-Norfolk-Newport News, VA-NC Metro Area",0.542460883,0.54795147,0.401749099,1.492161452
310M300US47300,"Visalia-Porterville, CA Metro Area",0.331735087,0.562211203,0.482966026,1.376912316
310M300US47340,"Wabash, IN Micro Area",0.51873406,0.627086063,0.338867105,1.484687228
310M300US47380,"Waco, TX Metro Area",0.429631074,0.494767194,0.438556233,1.362954501
310M300US47420,"Wahpeton, ND-MN Micro Area",0.57934522,0.616764092,0.387235372,1.583344684
310M300US47460,"Walla Walla, WA Metro Area",0.477173055,0.604542348,0.424866825,1.506582228
310M300US47540,"Wapakoneta, OH Micro Area",0.588234836,0.648860766,0.278982696,1.516078298
310M300US47580,"Warner Robins, GA Metro Area",0.474590027,0.531545628,0.444194413,1.450330068
310M300US47620,"Warren, PA Micro Area",0.483468472,0.563542198,0.384212118,1.431222788
310M300US47660,"Warrensburg, MO Micro Area",0.512230969,0.551682937,0.431846555,1.495760461
310M300US47700,"Warsaw, IN Micro Area",0.550695886,0.560652867,0.429106886,1.540455639
310M300US47780,"Washington, IN Micro Area",0.494936111,0.59097492,0.34537179,1.431282821
310M300US47820,"Washington, NC Micro Area",0.378589375,0.552071382,0.376801696,1.307462453
310M300US47900,"Washington-Arlington-Alexandria, DC-VA-MD-WV Metro Area",0.710938781,0.600245108,0.534612196,1.845796084
310M300US47920,"Washington Court House, OH Micro Area",0.446141052,0.532322451,0.310867188,1.289330692
310M300US47940,"Waterloo-Cedar Falls, IA Metro Area",0.513912523,0.620463524,0.438827754,1.573203801
310M300US47980,"Watertown, SD Micro Area",0.548358225,0.563417207,0.461477515,1.573252947
310M300US48020,"Watertown-Fort Atkinson, WI Micro Area",0.566141847,0.624218899,0.448364622,1.638725369
310M300US48060,"Watertown-Fort Drum, NY Metro Area",0.50051704,0.488195905,0.372358475,1.36107142
310M300US48100,"Wauchula, FL Micro Area",0.35321432,0.595165176,0.439784821,1.388164317
310M300US48140,"Wausau, WI Metro Area",0.538239417,0.645207497,0.410895169,1.594342083
310M300US48180,"Waycross, GA Micro Area",0.390293429,0.518267626,0.472643019,1.381204074
310M300US48220,"Weatherford, OK Micro Area",0.504795185,0.496744239,0.383237974,1.384777398
310M300US48260,"Weirton-Steubenville, WV-OH Metro Area",0.468251437,0.566409946,0.381178888,1.41584027
310M300US48300,"Wenatchee, WA Metro Area",0.521972842,0.571877479,0.453586688,1.547437009
310M300US48460,"West Plains, MO Micro Area",0.385716045,0.569015748,0.453607706,1.408339499
310M300US48500,"West Point, MS Micro Area",0.296033613,0.556110001,0.384419228,1.236562842
310M300US48540,"Wheeling, WV-OH Metro Area",0.471265193,0.579415415,0.409966279,1.460646887
310M300US48580,"Whitewater-Elkhorn, WI Micro Area",0.514237837,0.573547895,0.443654318,1.53144005
310M300US48620,"Wichita, KS Metro Area",0.508285716,0.559023363,0.422035419,1.489344498
310M300US48660,"Wichita Falls, TX Metro Area",0.449956504,0.5205925,0.444049778,1.414598782
310M300US48700,"Williamsport, PA Metro Area",0.496611462,0.578106954,0.403904146,1.478622562
310M300US48780,"Williston, ND Micro Area",0.671463857,0.512633686,0.451708772,1.635806315
310M300US48820,"Willmar, MN Micro Area",0.546019962,0.632560713,0.431694401,1.610275076
310M300US48900,"Wilmington, NC Metro Area",0.449559416,0.544431493,0.423233557,1.417224467
310M300US48940,"Wilmington, OH Micro Area",0.46839104,0.558754297,0.301283628,1.328428965
310M300US48980,"Wilson, NC Micro Area",0.398525995,0.533628376,0.436569988,1.368724359
310M300US49020,"Winchester, VA-WV Metro Area",0.588992827,0.562687527,0.465161325,1.616841679
310M300US49080,"Winnemucca, NV Micro Area",0.599824758,0.549784245,0.511502825,1.661111828
310M300US49100,"Winona, MN Micro Area",0.498449119,0.620802836,0.405327476,1.524579431
310M300US49180,"Winston-Salem, NC Metro Area",0.440454608,0.585669136,0.464267271,1.490391015
310M300US49220,"Wisconsin Rapids-Marshfield, WI Micro Area",0.53402161,0.631754199,0.425609145,1.591384954
310M300US49260,"Woodward, OK Micro Area",0.529117682,0.567682383,0.39810888,1.494908945
310M300US49300,"Wooster, OH Micro Area",0.525821895,0.629809742,0.344548316,1.500179953
310M300US49340,"Worcester, MA-CT Metro Area",0.551359595,0.596644923,0.459442393,1.607446912
310M300US49380,"Worthington, MN Micro Area",0.465332141,0.600354876,0.433904747,1.499591764
310M300US49420,"Yakima, WA Metro Area",0.42200637,0.560703283,0.4495613,1.432270953
310M300US49460,"Yankton, SD Micro Area",0.492820207,0.572598784,0.378424735,1.443843726
310M300US49620,"York-Hanover, PA Metro Area",0.557758229,0.612781845,0.464030654,1.634570728
310M300US49660,"Youngstown-Warren-Boardman, OH-PA Metro Area",0.446485481,0.583849249,0.382851034,1.413185765
310M300US49700,"Yuba City, CA Metro Area",0.43924489,0.561313972,0.473700799,1.474259661
310M300US49740,"Yuma, AZ Metro Area",0.384488114,0.56534616,0.41322277,1.363057044
310M300US49780,"Zanesville, OH Micro Area",0.453475528,0.576408063,0.344499525,1.374383117
310M300US49820,"Zapata, TX Micro Area",0.203537006,0.482714182,0.420995305,1.107246492
